{
  "schema_version": "v3.0",
  "paper": {
    "paper_key": "cat-2022-slot-1",
    "title": "CAT 2022 Slot 1",
    "slug": "cat-2022-slot-1",
    "description": "Official CAT 2022 Slot 1 Question Paper inferred from content",
    "year": 2022,
    "total_questions": 66,
    "total_marks": 198,
    "duration_minutes": 120,
    "sections": [
      "VARC",
      "DILR",
      "QA"
    ],
    "default_positive_marks": 3,
    "default_negative_marks": 1,
    "difficulty_level": "medium",
    "is_free": false,
    "published": false,
    "allow_pause": true,
    "attempt_limit": 0
  },
  "question_sets": [
    {
      "client_set_id": "VARC_RC_1",
      "section": "VARC",
      "set_type": "VARC",
      "display_order": 1,
      "context_type": "rc_passage",
      "context_title": "Stoicism & Emotions",
      "content_layout": "split_passage",
      "context_body": "Stoicism was founded in 300 BC by the Greek philosopher Zeno and survived into the Roman era until about AD 300\\. According to the Stoics, emotions consist of two movements. The first movement is the immediate feeling and other reactions (e.g., physiological response) that occur when a stimulus or event occurs. For instance, consider what could have happened if an army general accused Marcus Aurelius of treason in front of other officers. The first movement for Marcus may have been (internal) surprise and anger in response to this insult, accompanied perhaps by some involuntary physiological and expressive responses such as face flushing and a movement of the eyebrows. The second movement is what one does next about the emotion. Second movement behaviors occur after thinking and are under one’s control. Examples of second movements for Marcus might have included a plot to seek revenge, actions signifying deference and appeasement, or perhaps proceeding as he would have proceeded whether or not this event occurred: continuing to lead the Romans in a way that Marcus Aurelius believed best benefited them. In the Stoic view, choosing a reasoned, unemotional response as the second movement is the only appropriate response.\nThe Stoics believed that to live the good life and be a good person, we need to free ourselves of nearly all desires such as too much desire for money, power, or sexual gratification. Prior to second movements, we can consider what is important in life. Money, power, and excessive sexual gratification are not important. Character, rationality, and kindness are important. The Epicureans, first associated with the Greek philosopher Epicurus . . . held a similar view, believing that people should enjoy simple pleasures, such as good conversation, friendship, food, and wine, but not be indulgent in these pursuits and not follow passion for those things that hold no real value like power and money. As Oatley (2004) states, “the Epicureans articulated a view —enjoyment of relationship with friends, of things that are real rather than illusory, simple rather than artificially inflated, possible rather than vanishingly unlikely—that is certainly relevant today” . . .\nIn sum, these ancient Greek and Roman philosophers saw emotions, especially strong ones, as potentially dangerous. They viewed emotions as experiences that needed to be \\[reined\\] in and controlled. As Oatley (2004) points out, the Stoic idea bears some similarity to Buddhism. Buddha, living in India in the 6th century BC, argued for cultivating a certain attitude that decreases the probability of (in Stoic terms) destructive second movements. Through meditation and the right attitude, one allows emotions to happen to oneself (it is impossible to prevent this), but one is advised to observe the emotions without necessarily acting on them; one achieves some distance and decides what has value and what does not have value. Additionally, the Stoic idea of developing virtue in oneself, of becoming a good person, which the Stoics believed we could do because we have a touch of the divine, laid the foundation for the three monotheistic religions: Judaism, Christianity, and Islam . . . As with Stoicism, tenets of these religions include controlling our emotions lest we engage in sinful behavior."
    },
    {
      "client_set_id": "VARC_RC_2",
      "section": "VARC",
      "set_type": "VARC",
      "display_order": 2,
      "context_type": "rc_passage",
      "context_title": "Copies (East vs West)",
      "content_layout": "split_passage",
      "context_body": "The Chinese have two different concepts of a copy. Fangzhipin . . . are imitations where the difference from the original is obvious. These are small models or copies that can be purchased in a museum shop, for example. The second concept for a copy is fuzhipin . . . They are exact reproductions of the original, which, for the Chinese, are of equal value to the original. It has absolutely no negative connotations. The discrepancy with regard to the understanding of what a copy is has often led to misunderstandings and arguments between China and Western museums. The Chinese often send copies abroad instead of originals, in the firm belief that they are not essentially different from the originals. The rejection that then comes from the Western museums is perceived by the Chinese as an insult. . . .\nThe Far Eastern notion of identity is also very confusing to the Western observer. The Ise Grand Shrine \\[in Japan\\] is 1,300 years old for the millions of Japanese people who go there on pilgrimage every year. But in reality this temple complex is completely rebuilt from scratch every 20 years. . . . The cathedral of Freiburg Minster in southwest Germany is covered in scaffolding almost all year round. The sandstone from which it is built is a very soft, porous material that does not withstand natural erosion by rain and wind. After a while, it crumbles. As a result, the cathedral is continually being examined for damage, and eroded stones are replaced. And in the cathedral’s dedicated workshop, copies of the damaged sandstone figures are constantly being produced. Of course, attempts are made to preserve the stones from the Middle Ages for as long as possible. But at some point they, too, are removed and replaced with new stones. Fundamentally, this is the same operation as with the Japanese shrine, except in this case the production of a replica takes place very slowly and over long periods of time. . . .\nIn the field of art as well, the idea of an unassailable original developed historically in the Western world. Back in the 17th century \\[in the West\\], excavated artworks from antiquity were treated quite differently from today. They were not restored in a way that was faithful to the original. Instead, there was massive intervention in these works, changing their appearance. . . . It is probably this intellectual position that explains why Asians have far fewer scruples about cloning than Europeans. The South Korean cloning researcher Hwang Woo-suk, who attracted worldwide attention with his cloning experiments in 2004, is a Buddhist. He found a great deal of support and followers among Buddhists, while Christians called for a ban on human cloning. . . . Hwang legitimised his cloning experiments with his religious affiliation: ‘I am Buddhist, and I have no philosophical problem with cloning. And as you know, the basis of Buddhism is that life is recycled through reincarnation. In some ways, I think, therapeutic cloning restarts the circle of life.’"
    },
    {
      "client_set_id": "VARC_RC_3",
      "section": "VARC",
      "set_type": "VARC",
      "display_order": 3,
      "context_type": "rc_passage",
      "context_title": "The Undead",
      "content_layout": "split_passage",